{
  "schema_version": 1,
  "data_class": "private",
  "run_id": "tiny-run",
  "run_config_hash": "1111111111111111111111111111111111111111111111111111111111111111",
  "generation": 2,
  "generation_manifest_sha256": "2222222222222222222222222222222222222222222222222222222222222222",
  "checkpoints": {
    "preview": "3333333333333333333333333333333333333333333333333333333333333333",
    "battle": "4444444444444444444444444444444444444444444444444444444444444444"
  },
  "candidate_data_class": "private",
  "version_manifest": {
    "showdown_commit": "aaaaaaaaaaaaaaaaaaaaaaaaaaaaaaaaaaaaaaaa",
    "format_id": "gen9championsvgc2026regmc",
    "regulation": "M-C",
    "ruleset_hash": "5555555555555555555555555555555555555555555555555555555555555555",
    "format_rules_hash": "6666666666666666666666666666666666666666666666666666666666666666"
  },
  "test_set": {
    "commitment": "7777777777777777777777777777777777777777777777777777777777777777",
    "team_count": 7,
    "pairs": 3,
    "source_kind": "dataset",
    "dataset_hash": "9999999999999999999999999999999999999999999999999999999999999999",
    "subset": "all"
  },
  "plan": {
    "kind": "disjoint-pairs",
    "seed_derivation": "private-test-seed/1",
    "pairing": "private-test-pairing/1",
    "games_per_match": 6,
    "max_turns": 100,
    "latency_budget_ms": {
      "preview_ms": 1000,
      "battle_ms": 1000
    }
  },
  "matches": [
    {
      "match_id": "damage-aware-argmax",
      "policy_id": "policy:bbbbbbbbbbbbbbbbbbbbbbbbbbbbbbbbbbbbbbbbbbbbbbbbbbbbbbbbbbbbbbbb",
      "mode": "argmax",
      "opponent_policy_id": "damage-aware@v1",
      "games": 6,
      "wins": 4,
      "ties": 0,
      "losses": 2,
      "turn_cap_ties": 0,
      "forfeits": [
        {
          "side": "candidate",
          "cause": "latency_overrun",
          "count": 1
        },
        {
          "side": "opponent",
          "cause": "crash",
          "count": 2
        }
      ],
      "pairs": 3,
      "pair_score_counts": [
        0,
        0,
        2,
        0,
        1
      ]
    },
    {
      "match_id": "damage-aware-sample",
      "policy_id": "policy:aaaaaaaaaaaaaaaaaaaaaaaaaaaaaaaaaaaaaaaaaaaaaaaaaaaaaaaaaaaaaaaa",
      "mode": "sample",
      "opponent_policy_id": "damage-aware@v1",
      "games": 6,
      "wins": 3,
      "ties": 2,
      "losses": 1,
      "turn_cap_ties": 1,
      "forfeits": [],
      "pairs": 3,
      "pair_score_counts": [
        0,
        0,
        2,
        0,
        1
      ]
    }
  ]
}
